Склад;;
Номенклатура;Цена по прайсу;Артикул
Белокуриха;;
Forza10 Adult All Breed.ang/mcaps (26/16) Корм для взрослых собак всех пород из ягненка 20кг;5 200,00;0109048
Forza10 Adult All Breed.cerv/pat (26/15) Корм для взрослых собак всех пород из оленины и картоф 20кг;5 200,00;0109031
Forza10 Basic Breeders All Breeds Pesce (23.5/13.5)  для взрослых собак всех пород из  рыбы 20кг;4 141,00;0109043
Forza10 Basic Breeders All Breeds pollo (25.5/12)  Корм для взрослых собак всех пород из курицы 20кг;4 141,00;0109014
Forza10 Best Breeders Adult Mini pesce  (26/14) Корм для взрослых собак мелких пород из рыбы 20кг;5 075,00;0109025
Forza10 Breeders PUPPY Large 32/14 Корм с рыбой для щенков крупных и гиганстких пород 20кг;5 802,00;0109028
Forza10 Cat Hypoallergenic Корм для взрослых кошек с пищевой непереносимостью и аллергией 0,454;303,00;Е0020216454
Forza10 Cat Intestinal Active gatto Корм для взрослых кошек при проблемах пищеварения  0,454;347,00;Е0020214454
Forza10 Cat Intestinal Active gatto Корм для взрослых кошек при проблемах пищеварения  1,5кг;900,00;0904115
Forza10 Cat Maint pesce Корм для взрослых кошек на основе рыбы 0,5;212,00;0205500
Forza10 Cat Maint. pesce Корм для взрослых кошек на основе рыбы 2,0;819,00;0205002
Forza10 Cat MR Fruit Arancione Adult Indoor Корм для взрослых домашних кошек 0,4;236,00;0209400
Forza10 Cat MR Fruit Arancione Adult Indoor Корм для взрослых домашних кошек 1,5;674,00;0209015
Forza10 Cat MR Fruit Arancione Adult Indoor Корм для взрослых домашних кошек 12,0;3 901,00;Е0020209012
Forza10 Cat MR Fruit Giallo Neutered Корм для стерилизованных кошек 0,4;236,00;0210400
Forza10 Cat MR Fruit Giallo Neutered Корм для стерилизованных кошек 1,5;674,00;0210015
Forza10 Cat MR Fruit Giallo Neutered Корм для стерилизованных кошек 12,0;3 708,00;Е0020210012
Forza10 Cat MR Fruit Rosso Senior Корм для пожилых кошек 1,5;664,00;0211015
Forza10 Cat MR Fruit Viola Kitten Корм для котят 1,5;761,00;0213015
Forza10 Cat Regular Diet pesce Диетический корм для взрослых кошек из океанической рыбы 0,4;260,00;0203400
Forza10 Cat Regular Diet pesce Диетический корм для взрослых кошек из океанической рыбы 1,5;770,00;0203115
Forza10 Cat Renal Active Корм для взрослых кошек при почечной недостаточности 0,454;338,00;Е0020215454
Forza10 Cat Renal Active Корм для взрослых кошек при почечной недостаточности 1,5кг;824,00;0911015
Forza10 Cat Urinary Active Корм для взрослых кошек при заболеваниях мочевыводящих путей 0,454;347,00;Е0020217454
Forza10 Cat Urinary Active Корм для взрослых кошек при заболеваниях мочевыводящих путей 1,5кг;824,00;0217015
Forza10 Dermo Active Корм для взрослых собак всех пород с патологиями кожного покрова 4,0;2 022,00;E0020903004
Forza10 Lyx Active cane  (Ex-Ophtalmic) Корм для собак при патологиях  органов зрения 4 кг;2 456,00;0923004
Forza10 Med Diet Low Grain Cav pis Диетический корм для взрослых собак средних пород из конины1,5 кг;684,00;0110315
Forza10 Med Diet Low Grain Cav pis Диетический корм для взрослых собак средних пород из конины12 кг;3 842,00;0110312
Forza10 Med. Diet Agnello Диетический корм для взрослых собак средних пород из ягненка 12,0;3 746,00;0116012
Forza10 Med. Diet Agnello Диетический корм для взрослых собак средних пород из ягненка1,5кг;655,00;0116115
Forza10 Med. Diet cer/pat  Диетический корм для взрослых собак средних пород из оленины 1,5кг;631,00;0110115
Forza10 Med. Diet cer/pat Диетический корм для взрослых собак средних пород из оленины  12,0;3 592,00;0110012
Forza10 Med. Diet pesce Диетический корм для взрослых собак средних пород из рыбы  12кг;3 631,00;0103012
Forza10 Med. Diet pesce Диетический корм для взрослых собак средних пород из рыбы 1,5 кг;626,00;0103115
Forza10 Med. Maint.cer/pat Повседневный корм для взрослых собак средних пород  оленя с картофеле 2кг;756,00;0111002
Forza10 Med. Maint.pesce Повседневнй корм для взрослых собак средних пород из океанической рыбы  2кг;698,00;0106002
Forza10 Medium Adult Maint agn/riso Повседневный корм для взрослых собак средних и крупных пор12,5кг;3 178,00;0116112
Forza10 Mini Adult Maint agn/riso Корм для взрослых собак мелких пород из ягненка с рисом 2кг;689,00;0116002/1
Forza10 Mini Diet pesce Диетический корм для взрослых собак мелких пород из рыбы 1,5кг;631,00;0101115
Forza10 Mini Maint. pol/pat Повседневный корм для взрослых собак мелких пород из курицы и картоф 2кг;689,00;0118002
Forza10 Mini Maint.cer/pat Повседневный корм для взрослых собак мелких пород из оленины и картоф 2кг;756,00;0117002
Forza10 Pup Diet pesce Диетический корм для щенков из рыбы 1,5 кг;727,00;0108115
Forza10 Pup jun S/M pesce Корм из рыбы для щенков средних /мелких пород 2кг;838,00;0102012
Forza10 Pup jun S/M pol/pat Корм из курицы и картофеля  для щенков мелких/средних пород 2.0;775,00;0115002
HT DOG Puppy pate monoprotein calf meat puppy/МОНОПРОТЕИНОВЫЙ ВЛАЖНЫЙ КОРМ ДЛЯ ЩЕНКОВ 400гр.;149,00;11141
PREMIUM CAT FOOD PATE BEEF  / ПРЕМИУМ ВЛАЖНЫЙ КОРМ ДЛЯ КОШЕК ГОВЯДИНА 400гр;81,00;11152
PREMIUM CAT FOOD PATE CHICKEN / ПРЕМИУМ ВЛАЖНЫЙ КОРМ ДЛЯ КОШЕК КУРИЦА 400гр;81,00;11151
PREMIUM CAT FOOD PATE SALMON / ПРЕМИУМ ВЛАЖНЫЙ КОРМ ДЛЯ КОШЕК СЁМГА 400гр;81,00;11153
PREMIUM PRESTIGE DOG /  ПРЕМИУМ ВЛАЖНЫЙ КОРМ ДЛЯ СОБАК КУРИЦА И ИНДЕЙКА 400гр;81,00;2000
PREMIUM PRESTIGE SALMON / ПРЕМИУМ ВЛАЖНЫЙ КОРМ ДЛЯ СОБАК СЁМГА 400гр;81,00;2002